{
  "sensor_info": {
    "created_by": "FLBBFLRT2K-8660.xls SBS-WriteArgoSensor() V0.1 (RDS)",
    "date_creation": "2024-02-08T20:59:35.000Z",
    "link": "./argo.sensor.schema.json",
    "format_version": "0.5.0",
    "contents": "JSON description of Sea-Bird Scientific ECO sensor FLBBFLRT2K-8660",
    "sensor_described": "FLBBFLRT2K-8660"
  },
  "@context": {
    "SDN:R03::": "http://vocab.nerc.ac.uk/collection/R03/current/",
    "SDN:R25::": "http://vocab.nerc.ac.uk/collection/R25/current/",
    "SDN:R26::": "http://vocab.nerc.ac.uk/collection/R26/current/",
    "SDN:R27::": "http://vocab.nerc.ac.uk/collection/R27/current/"
  },
  "instrument_vendorinfo": {
    "vendor_schema": "SBE",
    "version": "0.2",
    "SBE_part_number": "FAA-538092"
  },
  "SENSORS": [
    {
      "SENSOR": "SDN:R25::FLUOROMETER_CHLA",
      "SENSOR_MAKER": "SDN:R26::WETLABS",
      "SENSOR_MODEL": "SDN:R27::ECO_FLBBFL",
      "SENSOR_FIRMWARE_VERSION": " ",
      "SENSOR_SERIAL_NO": "8660",
      "sensor_vendorinfo": {
        "vendor_schema": "SBE",
        "version": "0.2",
        "SBE_manufacturing_date": "2014-07-17T00:00:00Z",
        "CONFIG_EcoChlaFluorescenceExcitationWavelength_nm": 470,
        "CONFIG_EcoChlaFluorescenceExcitationBandwidth_nm": 23,
        "CONFIG_EcoChlaFluorescenceEmissionWavelength_nm": 695,
        "CONFIG_EcoChlaFluorescenceEmissionBandwidth_nm": 70
      }
    },
    {
      "SENSOR": "SDN:R25::BACKSCATTERINGMETER_BBP700",
      "SENSOR_MAKER": "SDN:R26::WETLABS",
      "SENSOR_MODEL": "SDN:R27::ECO_FLBBFL",
      "SENSOR_FIRMWARE_VERSION": " ",
      "SENSOR_SERIAL_NO": "8660",
      "sensor_vendorinfo": {
        "vendor_schema": "SBE",
        "version": "0.2",
        "SBE_manufacturing_date": "2014-07-17T00:00:00Z",
        "CONFIG_EcoBetaWavelength_nm": 700,
        "CONFIG_EcoBetaBandwidth_nm": 25,
        "CONFIG_EcoBetaAngle_angularDeg": 124
      }
    },
    {
      "SENSOR": "SDN:R25::FLUOROMETER_CHLA435",
      "SENSOR_MAKER": "SDN:R26::WETLABS",
      "SENSOR_MODEL": "SDN:R27::ECO_FLBBFL",
      "SENSOR_FIRMWARE_VERSION": " ",
      "SENSOR_SERIAL_NO": "8660",
      "sensor_vendorinfo": {
        "vendor_schema": "SBE",
        "version": "0.2",
        "SBE_manufacturing_date": "2014-07-17T00:00:00Z",
        "CONFIG_EcoChlaFluorescenceExcitationWavelength_nm": 435,
        "CONFIG_EcoChlaFluorescenceExcitationBandwidth_nm": 24,
        "CONFIG_EcoChlaFluorescenceEmissionWavelength_nm": 695,
        "CONFIG_EcoChlaFluorescenceEmissionBandwidth_nm": 70
      }
    }
  ],
  "PARAMETERS": [
    {
      "PARAMETER": "SDN:R03::FLUORESCENCE_CHLA",
      "PARAMETER_SENSOR": "SDN:R25::FLUOROMETER_CHLA",
      "PARAMETER_UNITS": "count",
      "PARAMETER_ACCURACY": " ",
      "PARAMETER_RESOLUTION": " ",
      "PREDEPLOYMENT_CALIB_EQUATION": " ",
      "PREDEPLOYMENT_CALIB_COEFFICIENT_LIST": {
      },
      "PREDEPLOYMENT_CALIB_COMMENT": "Uncalibrated chlorophyll-a fluorescence measurement",
      "PREDEPLOYMENT_CALIB_DATE": "2024-01-19T00:00:00Z"
    },
    {
      "PARAMETER": "SDN:R03::BETA_BACKSCATTERING700",
      "PARAMETER_SENSOR": "SDN:R25::BACKSCATTERINGMETER_BBP700",
      "PARAMETER_UNITS": "count",
      "PARAMETER_ACCURACY": " ",
      "PARAMETER_RESOLUTION": " ",
      "PREDEPLOYMENT_CALIB_EQUATION": " ",
      "PREDEPLOYMENT_CALIB_COEFFICIENT_LIST": {
      },
      "PREDEPLOYMENT_CALIB_COMMENT": "Uncalibrated backscattering measurement",
      "PREDEPLOYMENT_CALIB_DATE": "2024-01-19T00:00:00Z"
    },
    {
      "PARAMETER": "SDN:R03::FLUORESCENCE_CHLA435",
      "PARAMETER_SENSOR": "SDN:R25::FLUOROMETER_CHLA435",
      "PARAMETER_UNITS": "count",
      "PARAMETER_ACCURACY": " ",
      "PARAMETER_RESOLUTION": " ",
      "PREDEPLOYMENT_CALIB_EQUATION": " ",
      "PREDEPLOYMENT_CALIB_COEFFICIENT_LIST": {
      },
      "PREDEPLOYMENT_CALIB_COMMENT": "Uncalibrated fluorescence from coloured dissolved organic matter sensor",
      "PREDEPLOYMENT_CALIB_DATE": "2024-01-19T00:00:00Z"
    },
    {
      "PARAMETER": "SDN:R03::CHLA",
      "PARAMETER_SENSOR": "SDN:R25::FLUOROMETER_CHLA",
      "PARAMETER_UNITS": "mg/m3",
      "PARAMETER_ACCURACY": "0.08 mg/m3",
      "PARAMETER_RESOLUTION": "0.025 mg/m3",
      "PREDEPLOYMENT_CALIB_EQUATION": "CHLA = (FLUORESCENCE_CHLA - DARK_CHLA) * SCALE_CHLA",
      "PREDEPLOYMENT_CALIB_COEFFICIENT_LIST": {
        "SCALE_CHLA": "7.26e-03",
        "DARK_CHLA": "46"
      },
      "PREDEPLOYMENT_CALIB_COMMENT": "SBS Factory Calbration, 2024-01-19",
      "PREDEPLOYMENT_CALIB_DATE": "2024-01-19T00:00:00Z"
    },
    {
      "PARAMETER": "SDN:R03::BBP700",
      "PARAMETER_SENSOR": "SDN:R25::BACKSCATTERINGMETER_BBP700",
      "PARAMETER_UNITS": "m-1",
      "PARAMETER_ACCURACY": " ",
      "PARAMETER_RESOLUTION": " ",
      "PREDEPLOYMENT_CALIB_EQUATION": "BBP700=2*pi*khi*((BETA_BACKSCATTERING700-DARK_BACKSCATTERING700)*SCALE_BACKSCATTERING700-BETASW700)",
      "PREDEPLOYMENT_CALIB_COEFFICIENT_LIST": {
        "DARK_BACKSCATTERING700": "49",
        "SCALE_BACKSCATTERING700": "1.774e-06",
        "khi": "1.076",
        "BETASW700": "(contribution of pure sea water) is calculated at 124 angularDeg"
      },
      "PREDEPLOYMENT_CALIB_COMMENT": "SBS Factory Calbration, 2024-01-19",
      "PREDEPLOYMENT_CALIB_DATE": "2024-01-19T00:00:00Z"
    },
    {
      "PARAMETER": "SDN:R03::CHLA435",
      "PARAMETER_SENSOR": "SDN:R25::FLUOROMETER_CHLA435",
      "PARAMETER_UNITS": "mg/m3",
      "PARAMETER_ACCURACY": "0.08 mg/m3",
      "PARAMETER_RESOLUTION": "0.025 mg/m3",
      "PREDEPLOYMENT_CALIB_EQUATION": "CHLA435 = (FLUORESCENCE_CHLA435 - DARK_CHLA435) * SCALE_CHLA435",
      "PREDEPLOYMENT_CALIB_COEFFICIENT_LIST": {
        "SCALE_CHLA435": "7.25e-03",
        "DARK_CHLA435": "42"
      },
      "PREDEPLOYMENT_CALIB_COMMENT": "SBS Factory Calbration, 2024-01-19",
      "PREDEPLOYMENT_CALIB_DATE": "2024-01-19T00:00:00Z"
    }
  ]
}
