{
  "sensor_info": {
    "created_by": "BAK test",
    "date_creation": "2023-02-03T07:38:07Z",
    "link" : "./argo.sensor.schema.json",
    "format_version": "0.5.0",
    "contents": "json file to describe an Trios RAMSES Sensor on an Argo float for sensor schema vxx.xx.xx draft",
    "sensor_described": "AANDERAA-AANDERAA_OPTODE_4330-3901"
  },
  "@context": { 
    "SDN:R03::": "http://vocab.nerc.ac.uk/collection/R03/current/",
    "SDN:R25::": "http://vocab.nerc.ac.uk/collection/R25/current/",
    "SDN:R26::": "http://vocab.nerc.ac.uk/collection/R26/current/",
    "SDN:R27::": "http://vocab.nerc.ac.uk/collection/R27/current/",
    "SDN:L22::": "http://vocab.nerc.ac.uk/collection/L22/current/" 
  },
"SENSORS": [
    {
      "SENSOR": "SDN:R25::RADIOMETER_DOWN_IRR",
      "SENSOR_MAKER": "SDN:R26::TRIOS",
      "SENSOR_MODEL": "SDN:L22::TOOL0775",
      "SENSOR_FIRMWARE_VERSION": " ",
      "SENSOR_SERIAL_NO": "1600040",
      "sensor_vendorinfo": {
        "vendor_schema": "TRIOS",
        "version": "0.1",
        "TRIOS_RAMSESType": "Float"
      } 
  }
  ],
  "PARAMETERS": [
    {
        "PARAMETER": "SDN:R03::RADIOMETER_DOWN_IRR_INTEGRATION_TIME",
        "PARAMETER_SENSOR": "SDN:R25::RADIOMETER_DOWN_IRR",
        "PARAMETER_UNITS": "ms",
        "PARAMETER_ACCURACY": " ",
        "PARAMETER_RESOLUTION": " ",
        "PREDEPLOYMENT_CALIB_EQUATION": "none",
        "PREDEPLOYMENT_CALIB_COEFFICIENT_LIST": {  },
        "PREDEPLOYMENT_CALIB_COMMENT": " ",
        "PREDEPLOYMENT_CALIB_DATE": " "
    },
    {
        "PARAMETER": "SDN:R03::RADIOMETER_DOWN_IRR_PRE_PRES",
        "PARAMETER_SENSOR": "SDN:R25::RADIOMETER_DOWN_IRR",
        "PARAMETER_UNITS": "dbar",
        "PARAMETER_ACCURACY": " ",
        "PARAMETER_RESOLUTION": " ",
        "PREDEPLOYMENT_CALIB_EQUATION": "none",
        "PREDEPLOYMENT_CALIB_COEFFICIENT_LIST": {  },
        "PREDEPLOYMENT_CALIB_COMMENT": " ",
        "PREDEPLOYMENT_CALIB_DATE": " "
      },
      {
        "PARAMETER": "SDN:R03::RADIOMETER_DOWN_IRR_POST_PRES",
        "PARAMETER_SENSOR": "SDN:R25::RADIOMETER_DOWN_IRR",
        "PARAMETER_UNITS": "dbar",
        "PARAMETER_ACCURACY": " ",
        "PARAMETER_RESOLUTION": " ",
        "PREDEPLOYMENT_CALIB_EQUATION": "none",
        "PREDEPLOYMENT_CALIB_COEFFICIENT_LIST": {  },
        "PREDEPLOYMENT_CALIB_COMMENT": " ",
        "PREDEPLOYMENT_CALIB_DATE": " "
      },
      {
        "PARAMETER": "SDN:R03::RADIOMETER_DOWN_IRR_PRE_INCLINATION",
        "PARAMETER_SENSOR": "SDN:R25::RADIOMETER_DOWN_IRR",
        "PARAMETER_UNITS": "degree",
        "PARAMETER_ACCURACY": " ",
        "PARAMETER_RESOLUTION": " ",
        "PREDEPLOYMENT_CALIB_EQUATION": "none",
        "PREDEPLOYMENT_CALIB_COEFFICIENT_LIST": {  },
        "PREDEPLOYMENT_CALIB_COMMENT": " ",
        "PREDEPLOYMENT_CALIB_DATE": " "
      },
      {
        "PARAMETER": "SDN:R03::RADIOMETER_DOWN_IRR_POST_INCLINATION",
        "PARAMETER_SENSOR": "SDN:R25::RADIOMETER_DOWN_IRR",
        "PARAMETER_UNITS": "degree",
        "PARAMETER_ACCURACY": " ",
        "PARAMETER_RESOLUTION": " ",
        "PREDEPLOYMENT_CALIB_EQUATION": "none",
        "PREDEPLOYMENT_CALIB_COEFFICIENT_LIST": {  },
        "PREDEPLOYMENT_CALIB_COMMENT": " ",
        "PREDEPLOYMENT_CALIB_DATE": " "
      },
      {
        "PARAMETER": "SDN:R03::RADIOMETER_DOWN_IRR_DARK_AVERAGE",
        "PARAMETER_SENSOR": "SDN:R25::RADIOMETER_DOWN_IRR",
        "PARAMETER_UNITS": "count",
        "PARAMETER_ACCURACY": " ",
        "PARAMETER_RESOLUTION": " ",
        "PREDEPLOYMENT_CALIB_EQUATION": "none",
        "PREDEPLOYMENT_CALIB_COEFFICIENT_LIST": {  },
        "PREDEPLOYMENT_CALIB_COMMENT": " ",
        "PREDEPLOYMENT_CALIB_DATE": " "
      },
      {
        "PARAMETER": "SDN:R03::RAW_DOWNWELLING_IRRADIANCE",
        "PARAMETER_SENSOR": "SDN:R25::RADIOMETER_DOWN_IRR",
        "PARAMETER_UNITS": "count",
        "PARAMETER_ACCURACY": " ",
        "PARAMETER_RESOLUTION": " ",
        "PREDEPLOYMENT_CALIB_EQUATION": "none",
        "PREDEPLOYMENT_CALIB_COEFFICIENT_LIST": {  
            "OPTICAL_WAVELENGTH" : "",
            "B0" : "",
            "B1" : "",
            "S" : "",
            "Sair" : ""
        },
        "PREDEPLOYMENT_CALIB_COMMENT": " ",
        "PREDEPLOYMENT_CALIB_DATE": " ",
        "parameter_vendorinfo": {
            "vendor_schema": "TRIOS",
            "version": "0.1",
            "TRIOS_calfile" : " "
          },
        "predeployment_vendorinfo": {
        "example": "Vendors can add their own predeployment info here; they can add any field they like as a fieldname below predeployment_vendorinfo"
        }
    }
  ],
  "instrument_vendorinfo": {
    "example": "Vendors can add something about the whole instrument here; they can add field they like as a fieldname below instrument_vendorinfo"
  }
}