{
    "sensor_info": {
      "created_by": "ECR test",
      "date_creation": "2023-04-10T07:38:07-07:00",
      "link" : "./argo.sensor.schema.json",
      "format_version": "0.5.0",
      "contents": "json file to describe an MCOMS sensor for sensor schema v0.4.0 draft",
      "sensor_described": "WETLABS-MCOMS_FLBBCD-0157"
    },
    "@context": {
      "SDN:R03::": "http://vocab.nerc.ac.uk/collection/R03/current/",
      "SDN:R25::": "http://vocab.nerc.ac.uk/collection/R25/current/",
      "SDN:R26::": "http://vocab.nerc.ac.uk/collection/R26/current/",
      "SDN:R27::": "http://vocab.nerc.ac.uk/collection/R27/current/"
    },
    "SENSORS": [
      {
        "SENSOR": "SDN:R25::FLUOROMETER_CHLA",
        "SENSOR_MAKER": "SDN:R26::WETLABS",
        "SENSOR_MODEL": "SDN:R27::MCOMS_FLBBCD",
        "SENSOR_FIRMWARE_VERSION": "MCOMS 5.45",
        "SENSOR_SERIAL_NO": "0157",
        "sensor_vendorinfo": {
          "vendor_schema": "SBE",
          "version": "0.2",
          "SBE_manufacturing_date": "2020-01-01T00:00:00Z",
          "CONFIG_EcoChlaFluorescenceExcitationWavelength_nm": 470,
          "CONFIG_EcoChlaFluorescenceExcitationBandwidth_nm": 23,
          "CONFIG_EcoChlaFluorescenceEmissionWavelength_nm": 695,
          "CONFIG_EcoChlaFluorescenceEmissionBandwidth_nm": 70
        } 
      },
      {
        "SENSOR": "SDN:R25::BACKSCATTERINGMETER_BBP700",
        "SENSOR_MAKER": "SDN:R26::WETLABS",
        "SENSOR_MODEL": "SDN:R27::MCOMS_FLBBCD",
        "SENSOR_FIRMWARE_VERSION": "MCOMS 5.45",
        "SENSOR_SERIAL_NO": "0157",
        "sensor_vendorinfo": {
          "vendor_schema": "SBE",
          "version": "0.2",
          "SBE_manufacturing_date": "2020-01-01T00:00:00Z",
          "CONFIG_EcoBetaWavelength_nm": 700,
          "CONFIG_EcoBetaBandwidth_nm": 25,
          "CONFIG_EcoBetaAngle_angularDeg": 150
        }
      },
      {
        "SENSOR": "SDN:R25::FLUOROMETER_CDOM",
        "SENSOR_MAKER": "SDN:R26::WETLABS",
        "SENSOR_MODEL": "SDN:R27::MCOMS_FLBBCD",
        "SENSOR_FIRMWARE_VERSION": "MCOMS 5.45",
        "SENSOR_SERIAL_NO": "0157",
        "sensor_vendorinfo": {
          "vendor_schema": "SBE",
          "version": "0.2",
          "SBE_manufacturing_date": "2020-01-01T00:00:00Z",
          "CONFIG_EcoCdomFluorescenceExcitationWavelength_nm": 370,
          "CONFIG_EcoCdomFluorescenceExcitationBandwidth_nm": 15,
          "CONFIG_EcoCdomFluorescenceEmissionWavelength_nm": 460,
          "CONFIG_EcoCdomFluorescenceEmissionBandwidth_nm": 120
        }
      }
    ],
    "PARAMETERS": [
      {
        "PARAMETER": "SDN:R03::FLUORESCENCE_CHLA",
        "PARAMETER_SENSOR": "SDN:R25::FLUOROMETER_CHLA",
        "PARAMETER_UNITS": " ",
        "PARAMETER_ACCURACY": " ",
        "PARAMETER_RESOLUTION": " ",
        "PREDEPLOYMENT_CALIB_EQUATION": " ",
        "PREDEPLOYMENT_CALIB_COEFFICIENT_LIST": { },
        "PREDEPLOYMENT_CALIB_COMMENT": "Uncalibrated chlorophyll-a fluorescence measurement",
        "PREDEPLOYMENT_CALIB_DATE": "2021-03-31T00:00:00Z"
      },
      {
        "PARAMETER": "SDN:R03::BETA_BACKSCATTERING700",
        "PARAMETER_SENSOR": "SDN:R25::BACKSCATTERINGMETER_BBP700",
        "PARAMETER_UNITS": " ",
        "PARAMETER_ACCURACY": " ",
        "PARAMETER_RESOLUTION": " ",
        "PREDEPLOYMENT_CALIB_EQUATION": " ",
        "PREDEPLOYMENT_CALIB_COEFFICIENT_LIST": { },
        "PREDEPLOYMENT_CALIB_COMMENT": "Uncalibrated backscattering measurement",
        "PREDEPLOYMENT_CALIB_DATE": "2021-03-31T00:00:00Z"
      },
      {
        "PARAMETER": "SDN:R03::FLUORESCENCE_CDOM",
        "PARAMETER_SENSOR": "SDN:R25::FLUOROMETER_CDOM",
        "PARAMETER_UNITS": " ",
        "PARAMETER_ACCURACY": " ",
        "PARAMETER_RESOLUTION": " ",
        "PREDEPLOYMENT_CALIB_EQUATION": " ",
        "PREDEPLOYMENT_CALIB_COEFFICIENT_LIST": { },
        "PREDEPLOYMENT_CALIB_COMMENT": "fluorescence from coloured dissolved organic matter",
        "PREDEPLOYMENT_CALIB_DATE": "2021-03-31T00:00:00Z"
      },
      {
        "PARAMETER": "SDN:R03::CHLA",
        "PARAMETER_SENSOR": "SDN:R25::FLUOROMETER_CHLA",
        "PARAMETER_UNITS": "mg/m3",
        "PARAMETER_ACCURACY": "0.08 mg/m3",
        "PARAMETER_RESOLUTION": "0.024 mg/m3",
        "PREDEPLOYMENT_CALIB_EQUATION": "CHLA = (FLUORESCENCE_CHLA - DARK_CHLA) * SCALE_CHLA",
        "PREDEPLOYMENT_CALIB_COEFFICIENT_LIST": { 
            "SCALE_CHLA":"1.891E-03",
            "DARK_CHLA":"51"
        },
        "PREDEPLOYMENT_CALIB_COMMENT": "SBS FACTORY CALIBRATION, 2018-09-25",
        "PREDEPLOYMENT_CALIB_DATE": "2018-09-25T00:00:00Z"
      },
      {
        "PARAMETER": "SDN:R03::BBP700",
        "PARAMETER_SENSOR": "SDN:R25::BACKSCATTERINGMETER_BBP700",
        "PARAMETER_UNITS": "m-1",
        "PARAMETER_ACCURACY": " ",
        "PARAMETER_RESOLUTION": "4.67E-07",
        "PREDEPLOYMENT_CALIB_EQUATION": "BBP700=2*pi*khi*((BETA_BACKSCATTERING700-DARK_BACKSCATTERING700)*SCALE_BACKSCATTERING700-BETASW700)",
        "PREDEPLOYMENT_CALIB_COEFFICIENT_LIST": { 
            "DARK_BACKSCATTERING700" : "49",
            "SCALE_BACKSCATTERING700": "3.350E-07",
            "khi" : "1.142",
            "BETASW700" : "Contribution of pure sea water calculated at 150 angular deg"
        },
        "PREDEPLOYMENT_CALIB_COMMENT": "SBS FACTORY CALIBRATION, 2018-09-25",
        "PREDEPLOYMENT_CALIB_DATE": "2018-09-25T00:00:00Z"
      },
      {
        "PARAMETER": "SDN:R03::CDOM",
        "PARAMETER_SENSOR": "SDN:R25::FLUOROMETER_CDOM",
        "PARAMETER_UNITS": "ppb",
        "PARAMETER_ACCURACY": " ",
        "PARAMETER_RESOLUTION": "1.28E-02",
        "PREDEPLOYMENT_CALIB_EQUATION": "CDOM = (FLUORESCENCE_CDOM - DARK_CDOM) * SCALE_CDOM",
        "PREDEPLOYMENT_CALIB_COEFFICIENT_LIST": { 
            "SCALE_CDOM":"6.336E-03",
            "DARK_CDOM":"51"
        },
        "PREDEPLOYMENT_CALIB_COMMENT": "SBS FACTORY CALIBRATION, 2018-09-25",
        "PREDEPLOYMENT_CALIB_DATE": "2018-09-25T00:00:00Z"
      }
    ]
}
